{
  "$schema": "http://json-schema.org/draft-07/schema#",
  "$id": "https://surveybest.de/schema/questionnaire.schema.json",
  "title": "surveyBEST Fragebogen",
  "description": "Kanonisches Schema eines gebündelten Fragebogens (src/assets/questionnaires/quest_*.json). Maschinen-lesbare Single Source of Truth; die Laufzeit-Prüfung lebt in src/tools/questman/validate.js (validateQuestScoring) und der Schema-Guard test/jest/__tests__/questman_scoring_schema.test.js validiert ALLE Bögen.",
  "type": "object",
  "required": ["title", "short_title", "items"],
  "additionalProperties": true,
  "properties": {
    "title": { "type": "string", "minLength": 1 },
    "short_title": {
      "type": "string",
      "minLength": 1,
      "description": "Eindeutiger Schlüssel des Bogens (über die gesamte Sammlung). Wird in Presets/URLs referenziert."
    },
    "description": { "type": "string" },
    "keywords": { "type": "string", "description": "Komma-separierte Suchbegriffe." },
    "version": { "type": "string", "description": "Versionskennung des Bogens (Default \"1.0\"). Wird in /select angezeigt." },
    "updated": { "type": "string", "description": "Stand-/Änderungsdatum (ISO YYYY-MM-DD). Wird in /select als \"Stand …\" angezeigt." },
    "license": {
      "type": "object",
      "description": "Unverbindliche Lizenz-Einschätzung (Orientierung, keine Rechtsberatung). Konservativ: im Zweifel 'unclear'/'licensed'.",
      "required": ["status"],
      "properties": {
        "status": { "type": "string", "enum": ["free", "licensed", "unclear"], "description": "free=frei nutzbar/gemeinfrei/Eigenentwicklung, licensed=Lizenz erforderlich, unclear=Status unklar." },
        "note": { "type": "string", "description": "Hinweistext (Hover im Listen-Item)." }
      },
      "additionalProperties": true
    },
    "manual": { "type": "string", "description": "Optionaler Hinweistext (HTML erlaubt)." },
    "coding": {
      "$ref": "#/$defs/coding",
      "description": "Empfohlen. Ausnahmen ohne coding sind zulässig (z. B. IPAQ_short, PEM_Screening)."
    },
    "items": { "type": "array", "items": { "$ref": "#/$defs/item" }, "minItems": 1 },
    "results": { "$ref": "#/$defs/results" }
  },
  "$defs": {
    "coding": {
      "type": "object",
      "required": ["system", "code"],
      "properties": {
        "system": { "type": "string", "enum": ["http://snomed.info/sct", "LOINC", "CUSTOM", "LEC-SEQ"] },
        "code": { "type": ["string", "number"] },
        "display": { "type": "string" },
        "version": { "type": "string", "description": "Empfohlen (z. B. Datum), aktuell nur Warnung wenn fehlt." }
      },
      "additionalProperties": true
    },
    "item": {
      "type": "object",
      "required": ["label", "type"],
      "additionalProperties": true,
      "properties": {
        "label": { "type": "string", "description": "HTML erlaubt. Bei separator/textbox die anzuzeigende Überschrift/Info." },
        "type": {
          "type": "string",
          "enum": ["radio", "checkbox", "text", "number", "date", "date_year", "time", "slider", "multiple_radio", "separator", "textbox", "image", "drawing", "day_curve"],
          "description": "Deckt sich mit ITEM_TYPES in validate.js und den Renderern in QuestItemField.vue."
        },
        "id": {
          "description": "Numerische Item-id (oder Array). Referenziert von results.scoring/domaine. Nicht für separator/textbox.",
          "type": ["number", "string", "array"]
        },
        "tag": { "type": "string", "description": "Kategorie/Gruppen-Kürzel (frei)." },
        "value": { "description": "Antwortwert; Form je Typ (siehe docs/DATA_MODEL_ITEMS.md)." },
        "force": {
          "type": "boolean",
          "description": "Pflichtfeld-Schalter. WEGGELASSEN ⇒ Pflicht (Default required). Nur force:false macht ein Feld optional. Nicht-interaktive Typen (separator/textbox/image) sind nie Pflicht."
        },
        "inline": { "type": "boolean", "description": "Layout: radio/checkbox horizontal statt vertikal." },
        "rotate": { "type": "boolean", "description": "Layout (multiple_radio): lange Spaltenlabels schräg stellen." },
        "vertical": { "type": "boolean", "description": "Layout (slider): vertikale Ausrichtung." },
        "width": { "type": "number", "description": "Layout (image): Anzeigebreite in px." },
        "canvas": {
          "type": "object",
          "description": "Layout (drawing): quadratisches Zeichenfeld.",
          "properties": {
            "size": { "type": "number", "description": "Kantenlänge in px (Default 320)." },
            "background": { "type": "string", "description": "Vorlage: 'blank' | 'spiral' | '<datei>.png'." }
          }
        },
        "show_if": {
          "description": "Bedingte Frage: nur sichtbar, wenn die Bedingung (oder bei einer Liste: mindestens eine) erfüllt ist. Ausgeblendet = kein Pflichtfeld, zählt nicht im Fortschritt.",
          "oneOf": [ { "type": "object", "required": ["op"], "properties": { "item": { "description": "id des Bezugs-Items" }, "tag": { "type": "string", "description": "alternativ: tag des Bezugs-Items" }, "op": { "enum": ["includes", "equals", "not_equals", "gt", "gte", "answered"] }, "value": {}, "metric": { "type": "string", "description": "day_curve: Feld der Kurven-Auswertung, z. B. off_h, dys_h" } } }, { "type": "array", "items": { "type": "object", "required": ["op"], "properties": { "item": { "description": "id des Bezugs-Items" }, "tag": { "type": "string", "description": "alternativ: tag des Bezugs-Items" }, "op": { "enum": ["includes", "equals", "not_equals", "gt", "gte", "answered"] }, "value": {}, "metric": { "type": "string", "description": "day_curve: Feld der Kurven-Auswertung, z. B. off_h, dys_h" } } } } ]
        },
        "hidden_value": { "description": "Wert in den Ergebnissen, solange das Item per show_if ausgeblendet ist (z. B. 0 = niemals). Ohne hidden_value fällt es weg." },
        "exclusive_option": { "description": "checkbox: Optionswert (z. B. „keine“), der alle anderen ausschließt — und umgekehrt." },
        "curve": {
          "type": "object",
          "description": "Layout (day_curve): Tageskurve der Beweglichkeit. Alles optional.",
          "properties": {
            "start": { "type": "string", "description": "Beginn der Zeitachse HH:MM (Default 06:00)." },
            "step_min": { "type": "number", "description": "Raster in Minuten (Default 30)." },
            "hours": { "type": "number", "description": "Länge der Achse in Stunden (Default 24)." },
            "night_from": { "type": "string", "description": "Beginn der Nacht-Schattierung HH:MM (Default 22:00)." },
            "night_to": { "type": "string", "description": "Ende der Nacht-Schattierung HH:MM (Default 06:00)." },
            "markers": { "type": "array", "items": { "enum": ["pill", "meal"] }, "description": "Zeilen zum Antippen über der Kurve (Default pill + meal)." },
            "symptoms": { "type": "array", "items": { "type": "object", "required": ["key", "label"], "properties": { "key": { "type": "string" }, "label": { "type": "string" }, "color": { "type": "string" } } }, "description": "Beschwerde-Zeilen unter der Kurve (Default: Schmerzen, Sinnestäuschungen, Angst/Unruhe, starke Müdigkeit; [] = keine)." },
            "feedback": { "type": "boolean", "description": "Kennzahlen und Muster schon beim Ausfüllen zeigen (Default false: nur in der Auswertung)." }
          }
        },
        "hint": { "type": "string", "description": "Platzhalter/Hinweis (text/number)." },
        "caption": { "type": "string" },
        "min": { "type": "number", "description": "number: untere Grenze (<= max)." },
        "max": { "type": "number", "description": "number: obere Grenze (>= min)." },
        "ignore_for_result": { "type": "boolean" },
        "example_value": { "description": "Nur Vorschau (QuestManager). Wird im echten Ausfüll-Flow NICHT angezeigt." },
        "coding": { "$ref": "#/$defs/coding" },
        "options": {
          "description": "radio/checkbox: Array von {label,value}. multiple_radio: {questions:[...], answers:[...]}.",
          "oneOf": [
            { "type": "array", "items": { "$ref": "#/$defs/option" } },
            { "$ref": "#/$defs/matrixOptions" }
          ]
        }
      },
      "allOf": [
        {
          "if": { "properties": { "type": { "enum": ["radio", "checkbox"] } } },
          "then": { "required": ["options"], "properties": { "options": { "type": "array", "minItems": 1 } } }
        },
        {
          "if": { "properties": { "type": { "const": "multiple_radio" } } },
          "then": { "required": ["options"], "properties": { "options": { "$ref": "#/$defs/matrixOptions" } } }
        }
      ]
    },
    "option": {
      "type": "object",
      "required": ["label", "value"],
      "properties": {
        "label": { "type": "string" },
        "value": { "description": "Numerisch für bepunktete Items (NICHT string-numerisch wie \"3\")." },
        "coding": { "$ref": "#/$defs/coding" }
      },
      "additionalProperties": true
    },
    "matrixOptions": {
      "type": "object",
      "required": ["questions", "answers"],
      "properties": {
        "questions": {
          "type": "array",
          "minItems": 1,
          "items": {
            "type": "object",
            "required": ["label"],
            "properties": {
              "label": { "type": "string" },
              "tag": { "type": "string" },
              "id": { "type": ["number", "string"], "description": "Empfohlen — ermöglicht Sub-Scoring. Fehlt ⇒ Warnung MR_QUESTION_NO_ID." },
              "coding": { "$ref": "#/$defs/coding" }
            },
            "additionalProperties": true
          }
        },
        "answers": {
          "type": "array",
          "minItems": 1,
          "items": { "$ref": "#/$defs/option" }
        }
      },
      "additionalProperties": true
    },
    "results": {
      "type": "object",
      "description": "Optional (unbepunktete Bögen lassen results weg oder leer). Empfohlene Key-Reihenfolge: method, coding, evaluation, scoring, domaine.",
      "properties": {
        "method": { "type": "string", "enum": ["sum", "avg", "count", "count_targets", "ids", "nothing"] },
        "coding": { "$ref": "#/$defs/coding" },
        "evaluation": { "description": "Bereichs-Bewertung (range → label/coding)." },
        "scoring": {
          "type": "array",
          "items": {
            "type": "object",
            "properties": {
              "id": { "type": "array" },
              "value": { "type": "array" },
              "score": { "type": "array" },
              "method": { "type": "string", "enum": ["raw", "multiply", "range", "count"] },
              "coding": { "$ref": "#/$defs/coding" }
            },
            "additionalProperties": true
          }
        },
        "domaine": {
          "type": "array",
          "items": {
            "type": "object",
            "properties": {
              "label": { "type": "string" },
              "id": { "type": "array" },
              "method": { "type": "string", "enum": ["sum", "avg", "multiply", "sum_range", "diff_range", "sum_multiply", "avg_multiply", "sum_sub_multiply"] },
              "internal": { "type": "boolean" },
              "coding": { "$ref": "#/$defs/coding" }
            },
            "additionalProperties": true
          }
        }
      },
      "additionalProperties": true
    }
  }
}
