{
    "title": "SUS",
    "short_title": "sus",
    "coding" : {
        "system" : "http://snomed.info/sct",
        "code" : "445536008",
        "display" : "System Usability Scale (NeuroNation)",
        "version": "20211026"
    },
    "description": "System Usability Scale - NeuroNation",
    "manual": "user, usability, system, neuronation",
    "keywords": "sus_usability",
    "items": [
    	{
            "label": "Visit-Datum",
            "caption": "Bitte im folgenden Format eingeben: TTMMJJJJ",
            "tag": "date",
            "value": null,
            "type": "number",
            "inline": false,
            "force": true,
            "ignore_for_result": true
        },
    	{
            "label": "Bitte bewerten Sie die NeuroNation App. Sie haben dabei die Auswahl von 1 (Stimme gar nicht zu) bis 5 (Stimme voll zu).",
            "tag": "SUS",
            "id": [1,2,3,4,5,6,7,8,9,10],
            "caption": "",
            "value": [],
            "type": "multiple_radio",
            "inline": true,
            "options": {
                "answers": [
                    {"label": "1", "value": 0},
                    {"label": "2", "value": 1},
                    {"label": "3", "value": 2},
                    {"label": "4", "value": 3},
                    {"label": "5", "value": 4}
                ],
                "questions": [
                    {"id": 1, "label": "Ich kann mir gut vorstellen, das System regelmäßig zu nutzen.", "tag": "q1"},
                    {"id": 2, "label": "Ich empfinde das System als unnötig komplex.", "tag": "q2"},
                    {"id": 3, "label": "Ich empfinde das System als einfach zu nutzen", "tag": "q3"},
                    {"id": 4, "label": "Ich denke, dass ich technischen Support brauchen würde, um das System zu nutzen", "tag": "q4"},
                    {"id": 5, "label": "Ich finde, dass die verschiedenen Funktionen des Systems gut integriert sind.", "tag": "q5"},
                    {"id": 6, "label": "Ich finde, dass es im System zu viele Inkonsistenzen gibt.", "tag": "q6"},
                    {"id": 7, "label": "Ich kann mir vorstellen, dass die meisten Leute das System schnell zu beherrschen lernen.", "tag": "q7"},
                    {"id": 8, "label": "Ich empfinde die Bedienung als sehr umständlich.", "tag": "q8"},
                    {"id": 9, "label": "Ich habe mich bei der Nutzung des Systems sehr sicher gefühlt.", "tag": "q9"},
                    {"id": 10, "label": "Ich musste eine Menge Dinge lernen, bevor ich mit dem System arbeiten konnte.", "tag": "q10"}
                ]
            }
        }
    ],
    "results": {
        "method": "ids",
        "scoring": [
            {"id": [1,3,5,7,9], "value": [0,1,2,3,4], "score": [0,1,2,3,4]},
            {"id": [2,4,6,8,10], "value": [0,1,2,3,4], "score": [4,3,2,1,0]}

        ],
        "domaine":[
            {"label": "Raw sum", "id": [1,2,3,4,5,6,7,8,9,10], "method": "sum_multiply", "value": 2.5}  
        ]
    }

}